brokerage,street_address,city,province,postal_code
Advanced Realty Solutions Inc. Brokerage,551 Queen St,Chatham,ON,N7M 2J4
Buckingham Realty (Windsor) Ltd. Brokerage,4573 Tecumseh Road East,Windsor,ON,N8W 1K6
CMI REAL ESTATE INC,2425 Matheson Blvd 8th Floor,Mississauga,ON,L4W 5K4
Century 21 Local Home Team Realty Inc. Brokerage,310-3200 Deziel Dr,Windsor,ON,N8W 5K8
Century 21 Teams & Associates Ltd. Brokerage,11825 Tecumseh Rd East,Windsor,ON,N8N 1L8
Deerbrook Plus Realty Inc Brokerage,59 Eugenie St East,Windsor,ON,N8X 2X9
Deerbrook Realty Inc. Brokerage,59 Eugenie St East,Windsor,ON,N8X 2X9
Exp Realty Brokerage,3012 Tecumseh Rd E Unit B,Windsor,ON,N8W 1G7
Gagner & Associates Excel Realty Services Inc. (Blenheim) Brokerage,63 Talbot St West,Blenheim,ON,N0P 1A0
Gagner & Associates Excel Realty Services Inc. Brokerage Brokerage,149 St. Clair St,Chatham,ON,N7L 3J4
H. Featherstone Realty Inc. Brokerage,17 Erie St North,Leamington,ON,N8H 2Z2
Jump Realty Inc. Brokerage,300-3390 Walker Rd,Windsor,ON,N8W 3S1
Key Solutions Realty Ltd. Brokerage,1152 Victoria Ave,Windsor,ON,N9A 4N8
Kw Signature Brokerage,3070 Jefferson Blvd,Windsor,ON,N8T 3G9
Latitude Realty Inc. Brokerage,9525 River Line,Chatham,ON,N7M 5J4
Lc Platinum Realty Inc. Brokerage,2518 Ouellette Ave,Windsor,ON,N8X 1L7
Manor Windsor Realty Ltd. Brokerage,3276 Walker Rd,Windsor,ON,N8W 3R8
Marketplace Realty Inc. Brokerage,,,ON,
Match Realty Inc. Brokerage,15 Grand Ave West,Chatham,ON,N7L 1B4
Nest Realty Inc. Brokerage,14-B William St North,Chatham,ON,N7M 4L1
Nu Stream Realty (Toronto) Inc Brokerage,4553 Southwood Lakes Blvd,Windsor,ON,N9G 2M3
O'brien Robertson Realty Inc. Brokerage Brokerage,28 Talbot St West,Blenheim,ON,N0P 1A0
O'rourke Real Estate Inc. Brokerage Brokerage,82 Erie St South,Ridgetown,ON,N0P 2C0
One Percent Realty Ltd Brokerage,3075 Kenilworth Dr,Windsor,ON,N9E 4M6
Pinnacle Plus Realty Ltd. Brokerage,5444 Tecumseh Rd East,Windsor,ON,N8T 1C7
Re/Max Preferred Realty Ltd. Brokerage,6505 Tecumseh Rd East,Windsor,ON,N8T 1E7
Real Broker Ontario Ltd Brokerage,130 King St West Unit 1900B,Toronto,ON,M5X 1E3
Realty Connects Inc. Brokerage,419 St. Clair St,Chatham,ON,N7L 3K4
Realty House Inc. Brokerage Brokerage,,,ON,
Realty One Group Iconic Brokerage Brokerage,531 Pelissier St Unit 101,Windsor,ON,N9A 4L2
Remax Capital Diamond Realty Brokerage,2451 Dougall Ave Unit C,Windsor,ON,N8X 1T3
Remax Care Realty Brokerage,12105 Tecumseh Rd East,Windsor,ON,N8N 1M2
Remax Preferred Realty Ltd. - 585 Brokerage,6505 Tecumseh Rd East,Windsor,ON,N8T 1E7
Remax Preferred Realty Ltd. - 586 Brokerage,80 Sandwich St South,Amherstburg,ON,N9V 1Z6
Remax Preferred Realty Ltd. - 588 Brokerage,375 Main St East,Kingsville,ON,N9Y 1A7
Remo Valente Real Estate (1990) Limited Brokerage,2985 Dougall Ave,Windsor,ON,N9E 1S1
Request Realty Inc. Brokerage,5135 Tecumseh Rd East,Windsor,ON,N8T 1C3
Royal Lepage Binder Real Estate Brokerage,1350 Provincial Rd,Windsor,ON,N8W 5W1
Royal Lepage Binder Real Estate Inc - 633 Brokerage,5885 Wyandotte St East,Windsor,ON,N8S 1M7
Royal Lepage Peifer Realty (Dresden) Brokerage,29575 St. George St,Dresden,ON,N0P 1M0
Royal Lepage Peifer Realty Brokerage Brokerage,425 McNaughton Ave West,Chatham,ON,N7L 4K4
Royal Lepage Peifer Realty(Blen) Brokerage Brokerage,59 Talbot St West,Blenheim,ON,N0P 1A0
The Dan Gemus Real Estate Team Ltd. Brokerage,A-61 Richmond St,Amherstburg,ON,N9V 1G1
